[
  {
    "slug": "royal-wedding-celebration-2026-1",
    "href": "https://indexecoresort.com/events/royal-wedding-celebration-2026-1",
    "banner": {
      "src": "/media/public/storage/images/admin/events/CAlx6Qdr7XyeISQV6XaYVVTJRaRl0TpcfaS7W22A.jpg",
      "alt": "Event Banner"
    },
    "meta": [
      "08,08",
      "17:43:00"
    ],
    "html": "<p>Celebrate your special day with an unforgettable wedding event at our beautiful resort. The event includes a grand wedding ceremony, elegant stage decoration, live music, buffet dinner, photography session, guest accommodation, and entertainment facilities. Our professional team will ensure a memorable experience for the bride, groom, and guests in a peaceful and luxurious environment.</p>",
    "infoTitle": "Event Information",
    "info": {
      "Start date": "2026-05-08",
      "End date": "2026-05-10",
      "Time": "17:43:00 – 05:43:00",
      "Location": "Index Eco Resort & Convention Center, Dhaka, Bangladesh",
      "Category": "Wedding & Reception"
    },
    "bookingCta": {
      "label": "Booking Now",
      "href": "#"
    },
    "comments": {
      "enabled": false,
      "title": "Leave a Reply",
      "note": "Your email address will not be published. Required fields are marked *",
      "saveInfoLabel": "Save my name, email, and website in this browser for the next time I comment.",
      "saveInfoChecked": true,
      "fields": [
        {
          "name": null,
          "type": "text",
          "placeholder": "Name"
        },
        {
          "name": null,
          "type": "email",
          "placeholder": "Email"
        },
        {
          "name": null,
          "type": "url",
          "placeholder": "Website"
        },
        {
          "name": null,
          "type": "textarea",
          "placeholder": "Comment"
        }
      ],
      "submitLabel": "Post Comment",
      "endpoint": null
    },
    "relatedTitle": "Explore Related Events",
    "related": []
  },
  {
    "slug": "annual-corporate-summit-2026-2",
    "href": "https://indexecoresort.com/events/annual-corporate-summit-2026-2",
    "banner": {
      "src": "/media/public/storage/images/admin/events/hgVfKSQjYlpFnRhMnjdUvUMHMQIC7BSbGgOMdSHv.jpg",
      "alt": "Event Banner"
    },
    "meta": [
      "06,06",
      "17:49:00"
    ],
    "html": "<p>This corporate event is designed for companies, organizations, and professionals to host conferences, seminars, training sessions, product launches, and business meetings. The event includes modern conference hall setup, projector &amp; audio-visual facilities, seating arrangements, catering services, coffee breaks, and networking sessions. It is ideal for strengthening business relationships and sharing new ideas in a professional environment.</p>",
    "infoTitle": "Event Information",
    "info": {
      "Start date": "2026-05-06",
      "End date": "2026-05-28",
      "Time": "17:49:00 – 05:49:00",
      "Location": "Index Eco Resort & Convention Center, Conference Hall, Dhaka, Banglade",
      "Category": "Corporate Events & Conferences"
    },
    "bookingCta": {
      "label": "Booking Now",
      "href": "#"
    },
    "comments": {
      "enabled": false,
      "title": "Leave a Reply",
      "note": "Your email address will not be published. Required fields are marked *",
      "saveInfoLabel": "Save my name, email, and website in this browser for the next time I comment.",
      "saveInfoChecked": true,
      "fields": [
        {
          "name": null,
          "type": "text",
          "placeholder": "Name"
        },
        {
          "name": null,
          "type": "email",
          "placeholder": "Email"
        },
        {
          "name": null,
          "type": "url",
          "placeholder": "Website"
        },
        {
          "name": null,
          "type": "textarea",
          "placeholder": "Comment"
        }
      ],
      "submitLabel": "Post Comment",
      "endpoint": null
    },
    "relatedTitle": "Explore Related Events",
    "related": []
  },
  {
    "slug": "joyful-birthday-family-gathering-celebration-3",
    "href": "https://indexecoresort.com/events/joyful-birthday-family-gathering-celebration-3",
    "banner": {
      "src": "/media/public/storage/images/admin/events/iN5ldboMTrbKZn7S68IUqXGsYpufARgEnhZSXsVp.jpg",
      "alt": "Event Banner"
    },
    "meta": [
      "07,07",
      "20:51:00"
    ],
    "html": "<p>Celebrate your special moments with family and friends in a beautiful resort environment. This event includes themed birthday decoration, cake cutting ceremony, DJ music, kids’ play area, photography session, and delicious buffet or BBQ dinner. It is perfect for birthdays, anniversaries, reunion parties, and small family gatherings, ensuring joyful memories in a relaxed and scenic atmosphere.</p>",
    "infoTitle": "Event Information",
    "info": {
      "Start date": "2026-05-07",
      "End date": "2026-05-29",
      "Time": "20:51:00 – 17:54:00",
      "Location": "Resort & Garden Area, Dhaka, Bangladesh",
      "Category": "Birthday Parties & Family Celebrations"
    },
    "bookingCta": {
      "label": "Booking Now",
      "href": "#"
    },
    "comments": {
      "enabled": false,
      "title": "Leave a Reply",
      "note": "Your email address will not be published. Required fields are marked *",
      "saveInfoLabel": "Save my name, email, and website in this browser for the next time I comment.",
      "saveInfoChecked": true,
      "fields": [
        {
          "name": null,
          "type": "text",
          "placeholder": "Name"
        },
        {
          "name": null,
          "type": "email",
          "placeholder": "Email"
        },
        {
          "name": null,
          "type": "url",
          "placeholder": "Website"
        },
        {
          "name": null,
          "type": "textarea",
          "placeholder": "Comment"
        }
      ],
      "submitLabel": "Post Comment",
      "endpoint": null
    },
    "relatedTitle": "Explore Related Events",
    "related": []
  },
  {
    "slug": "index-eco-resort-coxs-bazar-2026-business-conference-4",
    "href": "https://indexecoresort.com/events/index-eco-resort-coxs-bazar-2026-business-conference-4",
    "banner": {
      "src": "/media/public/storage/images/admin/events/45fa4wTEAS9bZXaW2Er4IUlYKzLEDtys7kLVVMgB.jpg",
      "alt": "Event Banner"
    },
    "meta": [
      "29,29",
      ""
    ],
    "html": "",
    "infoTitle": "Event Information",
    "info": {
      "Start date": "",
      "End date": "",
      "Time": "–",
      "Location": "cox's Bazar.",
      "Category": "2026 BUSINESS CONFERENCE"
    },
    "bookingCta": {
      "label": "Booking Now",
      "href": "#"
    },
    "comments": {
      "enabled": false,
      "title": "Leave a Reply",
      "note": "Your email address will not be published. Required fields are marked *",
      "saveInfoLabel": "Save my name, email, and website in this browser for the next time I comment.",
      "saveInfoChecked": true,
      "fields": [
        {
          "name": null,
          "type": "text",
          "placeholder": "Name"
        },
        {
          "name": null,
          "type": "email",
          "placeholder": "Email"
        },
        {
          "name": null,
          "type": "url",
          "placeholder": "Website"
        },
        {
          "name": null,
          "type": "textarea",
          "placeholder": "Comment"
        }
      ],
      "submitLabel": "Post Comment",
      "endpoint": null
    },
    "relatedTitle": "Explore Related Events",
    "related": []
  }
]
